"Product ID [Non Editable]","Variant ID [Non Editable]","Product Type [Non Editable]","Product Page","Product URL","Title","Description","SKU","Option Name 1","Option Value 1","Option Name 2","Option Value 2","Option Name 3","Option Value 3","Option Name 4","Option Value 4","Option Name 5","Option Value 5","Option Name 6","Option Value 6","Price","Sale Price","On Sale","Stock","Categories","Tags","Weight","Length","Width","Height","Visible","Hosted Image URLs"
"686c7780605bc250b3497e76","4825deac-f648-439d-ba26-aceb6ad8f420","SERVICE","book","pattaya-golf-experience","Pattaya Golf Experience","<p style=""white-space:pre-wrap;"" data-rte-preserve-empty=""true"">Dive into Thailand's vibrant culture with our Pattaya Golf Experience. Perfect for golf enthusiasts and nightlife lovers alike, this service promises unforgettable memories.</p><p style=""white-space:pre-wrap;"" data-rte-preserve-empty=""true"">• Explore world-class golf courses in stunning locations.</p><p style=""white-space:pre-wrap;"" data-rte-preserve-empty=""true"">• Enjoy Pattaya's lively nightlife with access to top venues.</p><p style=""white-space:pre-wrap;"" data-rte-preserve-empty=""true"">• Savour breathtaking views and exquisite local cuisine.</p><p style=""white-space:pre-wrap;"" data-rte-preserve-empty=""true"">Transform your vacation into a captivating adventure that blends sport, relaxation, and vibrant nightlife. Create cherished memories and experience Pattaya like never before.</p>","SQ6694781","","","","","","","","","","","","","3995.00","0.00","No","Unlimited","/golf-tours, /thailand-golf, /golf-experience","Golf Experience, Pattaya Tour, Nightlife Adventure, Thailand Vacation, Golf Enthusiasts, Travel & Leisure","","","","","Yes","https://images.squarespace-cdn.com/content/v1/5fe1a66187b1197541ed9f92/cd5ee805-4e33-49f3-a5e9-0c616731a27e/Laem+Chabang+Caddie.jpg https://images.squarespace-cdn.com/content/v1/5fe1a66187b1197541ed9f92/4036f5eb-b3ab-46d1-a960-8bb83bc0b2f3/Laem+Chabang+GC.jpg https://images.squarespace-cdn.com/content/v1/5fe1a66187b1197541ed9f92/45735596-58ca-461a-84d2-6b9e05136467/Siam+CC+LPGA.jpg https://images.squarespace-cdn.com/content/v1/5fe1a66187b1197541ed9f92/25bdf2d0-1f82-4343-b3b1-7b64b0a5fbcf/Siam+Old.jpg https://images.squarespace-cdn.com/content/v1/5fe1a66187b1197541ed9f92/0d029681-d2fa-4dd2-b4e9-65730676f8d5/Siam+Rolling+Hills.jpg https://images.squarespace-cdn.com/content/v1/5fe1a66187b1197541ed9f92/3189c76e-0db7-4f19-a688-80b21cda3733/Siam+Rolling+Hills+2.jpg https://images.squarespace-cdn.com/content/v1/5fe1a66187b1197541ed9f92/6b354984-aaa2-4215-b116-ea138dd7888e/Siam+CC+Old+Course.jpg https://images.squarespace-cdn.com/content/v1/5fe1a66187b1197541ed9f92/ddfeb46c-ef0c-4ec3-9c77-fe41b28a1b60/Siam+CC+Plantation+Course.jpg https://images.squarespace-cdn.com/content/v1/5fe1a66187b1197541ed9f92/2fb2b521-9668-42d7-9a14-64a9cfa56d43/Siam+Course+Rolling+Hills.jpg"
"686c79a4b5c33969bd7df210","1c4b2d73-624b-41d5-8225-9b59a71702da","SERVICE","book","bangkoks-premier-golf-experience","Bangkok's Premier Golf Experience","<p style=""white-space:pre-wrap;"" data-rte-preserve-empty=""true"">Discover the ultimate blend of relaxation and recreation with a premium golf package in the heart of Bangkok. Perfect your swing amidst stunning landscapes and modern facilities.</p><p style=""white-space:pre-wrap;"" data-rte-preserve-empty=""true"">• Exclusive access to a world-class golf course</p><p style=""white-space:pre-wrap;"" data-rte-preserve-empty=""true"">• State-of-the-art facilities and luxury amenities</p><p style=""white-space:pre-wrap;"" data-rte-preserve-empty=""true"">• Experience the amazing heritage &amp; food culture that defines this vibrant city</p><p style=""white-space:pre-wrap;"" data-rte-preserve-empty=""true"">Escape the hustle and bustle of city life and indulge in a day of tranquility, refinement, and sport. Create lasting memories on the lush greens and unwind in style.</p>","SQ3979830","","","","","","","","","","","","","1995.00","0.00","No","Unlimited","","golf, Bangkok, luxury experience, sports, leisure, relaxation, coaching, modern amenities","","","","","Yes","https://images.squarespace-cdn.com/content/v1/5fe1a66187b1197541ed9f92/914eb628-b4ee-496d-848a-d743a0c0f5a0/Nikanti+GC.jpg https://images.squarespace-cdn.com/content/v1/5fe1a66187b1197541ed9f92/35851d0e-e727-4e6b-aadf-4532a0a471e0/Nikanti+2.jpg https://images.squarespace-cdn.com/content/v1/5fe1a66187b1197541ed9f92/4a12577b-71ab-4317-8445-3474e7b7136f/Nikanti+GC+1.jpg https://images.squarespace-cdn.com/content/v1/5fe1a66187b1197541ed9f92/8c0bba78-891c-4652-b277-8ca24b99cfbd/Royal+Bang+Pa+In+2.jpg https://images.squarespace-cdn.com/content/v1/5fe1a66187b1197541ed9f92/aba49d33-dde8-4157-b4b8-ebe050a5045b/Royal+Bang+Pa+In.jpg https://images.squarespace-cdn.com/content/v1/5fe1a66187b1197541ed9f92/6d10848c-1495-4588-9a43-32ee82e8da4f/RM+MR+2.jpeg https://images.squarespace-cdn.com/content/v1/5fe1a66187b1197541ed9f92/5fe49731-771d-4d24-a61e-e638b468e019/RG+Augusta+15.jpg https://images.squarespace-cdn.com/content/v1/5fe1a66187b1197541ed9f92/a7674d4b-85a4-4b08-b8cd-2e29064875b8/RG+TPC+Sawgraa.jpg"
"686c84182298e56c57b744d6","12f3fe94-3108-42da-ac1d-9b6c642146e7","SERVICE","book","da-nang-golf-adventure-package","Da Nang Golf Adventure Package - Sold Out!","<p style=""white-space:pre-wrap;"" data-rte-preserve-empty=""true"">Discover the ultimate golf getaway in Da Nang, Vietnam, where world-class courses meet breathtaking landscapes and rich cultural experiences. Perfect for golf enthusiasts seeking both play and relaxation.</p>
    <p style=""white-space:pre-wrap;"" data-rte-preserve-empty=""true"">• Play at award-winning golf courses with stunning views and challenging holes.</p><p style=""white-space:pre-wrap;"" data-rte-preserve-empty=""true"">• Experience the vibrant culture and natural beauty of Da Nang while savoring local cuisine.</p><p style=""white-space:pre-wrap;"" data-rte-preserve-empty=""true"">• Enjoy luxury accommodations and personalized service tailored to your golfing needs.</p>
    <p style=""white-space:pre-wrap;"" data-rte-preserve-empty=""true"">Elevate your golfing experience with a trip that combines your love for the game with the adventure of exploring a new culture. Make unforgettable memories on and off the course.</p>","SQ3968043","","","","","","","","","","","","","3695.00","0.00","No","0","","Golf, Da Nang, Vietnam, Travel, Luxury, Culture, Adventure, Golf Courses, Getaway","","","","","Yes","https://images.squarespace-cdn.com/content/v1/5fe1a66187b1197541ed9f92/aa8aa824-694d-4866-9d28-3c590dba1505/Hoiana+Shores.jpg https://images.squarespace-cdn.com/content/v1/5fe1a66187b1197541ed9f92/6ef411c0-73f5-4d5e-943a-3c6c9f9ae714/Montgomerie+Links.jpg https://images.squarespace-cdn.com/content/v1/5fe1a66187b1197541ed9f92/1f91d9fb-ce3b-4509-873f-2aa69025bcf4/Laguna+Golf+Lang+Co.jpg https://images.squarespace-cdn.com/content/v1/5fe1a66187b1197541ed9f92/f7f541b7-b81e-4ae2-9f85-2fea4cd03fa0/BRG+Da+Nang+.jpg https://images.squarespace-cdn.com/content/v1/5fe1a66187b1197541ed9f92/7fac7840-116a-47cb-bd8b-2b83269f17f4/Ba+Na+Hills.jpg https://images.squarespace-cdn.com/content/v1/5fe1a66187b1197541ed9f92/206b8ba1-e865-4465-9813-dbd4d2b13bc8/BaNaHills_11atNight.jpg https://images.squarespace-cdn.com/content/v1/5fe1a66187b1197541ed9f92/41319294-22db-46a7-9db4-259971d722ac/BaNaHills_NightAerial_0054.jpg"
